{
  "event_id": "E2026-03-10-001",
  "asset_id": "U1-RPS-CORE",
  "generated_at": "2026-03-10T16:00:00Z",
  "window": {
    "start": "2026-03-10T14:21:00Z",
    "end": "2026-03-10T14:24:00Z",
    "baseline_start": "2026-03-10T13:00:00Z",
    "baseline_end": "2026-03-10T14:20:00Z"
  },
  "analysis_methods": ["threshold_check", "changepoint_detection", "descriptive_stats"],
  "signals": [
    {
      "sensor_id": "U1-NI-RPS-4A",
      "parameter": "neutron_flux_channel_4",
      "unit": "percent_rated",
      "stats": {"mean": 101.2, "std": 4.8, "min": 98.9, "max": 112.3, "p25": 99.1, "p75": 103.2, "p95": 110.1, "sample_count": 360},
      "baseline_comparison": {"baseline_mean": 99.1, "baseline_std": 0.3, "delta_mean": 2.1, "delta_std": 4.5, "percent_change": 2.1, "deviation_sigma": 7.0},
      "anomalies": [
        {
          "anomaly_id": "ANOM-NI4-001",
          "detection_method": "threshold_exceedance",
          "pattern": "step_change",
          "timestamp_start": "2026-03-10T14:22:03Z",
          "timestamp_end": "2026-03-10T14:22:04Z",
          "peak_value": 112.3,
          "promoted_to_kg_event": true,
          "kg_event_id": "E2026-03-10-001",
          "promotion_rationale": "NI channel 4 exceeded 105% rated power trip setpoint — RPS actuation."
        }
      ],
      "changepoints": [],
      "within_normal_limits": false,
      "data_quality": {"missing_fraction": 0.0, "flatline_detected": false, "outlier_fraction": 0.0, "quality_flags": []}
    },
    {
      "sensor_id": "U1-NI-RPS-1A",
      "parameter": "neutron_flux_channel_1",
      "unit": "percent_rated",
      "stats": {"mean": 99.2, "std": 0.2, "min": 98.8, "max": 99.6, "p25": 99.1, "p75": 99.4, "p95": 99.5, "sample_count": 360},
      "baseline_comparison": {"baseline_mean": 99.1, "baseline_std": 0.3, "delta_mean": 0.1, "delta_std": -0.1, "percent_change": 0.1, "deviation_sigma": 0.3},
      "anomalies": [],
      "changepoints": [],
      "within_normal_limits": true,
      "data_quality": {"missing_fraction": 0.0, "flatline_detected": false, "outlier_fraction": 0.0, "quality_flags": []}
    },
    {
      "sensor_id": "U1-NI-RPS-2A",
      "parameter": "neutron_flux_channel_2",
      "unit": "percent_rated",
      "stats": {"mean": 99.3, "std": 0.2, "min": 98.9, "max": 99.7, "p25": 99.2, "p75": 99.5, "p95": 99.6, "sample_count": 360},
      "baseline_comparison": {"baseline_mean": 99.1, "baseline_std": 0.3, "delta_mean": 0.2, "delta_std": -0.1, "percent_change": 0.2, "deviation_sigma": 0.7},
      "anomalies": [],
      "changepoints": [],
      "within_normal_limits": true,
      "data_quality": {"missing_fraction": 0.0, "flatline_detected": false, "outlier_fraction": 0.0, "quality_flags": []}
    },
    {
      "sensor_id": "U1-NI-RPS-3A",
      "parameter": "neutron_flux_channel_3",
      "unit": "percent_rated",
      "stats": {"mean": 99.1, "std": 0.2, "min": 98.7, "max": 99.5, "p25": 99.0, "p75": 99.3, "p95": 99.4, "sample_count": 360},
      "baseline_comparison": {"baseline_mean": 99.1, "baseline_std": 0.3, "delta_mean": 0.0, "delta_std": -0.1, "percent_change": 0.0, "deviation_sigma": 0.0},
      "anomalies": [],
      "changepoints": [],
      "within_normal_limits": true,
      "data_quality": {"missing_fraction": 0.0, "flatline_detected": false, "outlier_fraction": 0.0, "quality_flags": []}
    },
    {
      "sensor_id": "U1-FCV-FW-3301",
      "parameter": "feedwater_control_valve_3_position",
      "unit": "percent_open",
      "stats": {"mean": 72.1, "std": 1.8, "min": 68.2, "max": 76.4, "p25": 70.8, "p75": 73.6, "p95": 75.1, "sample_count": 360},
      "baseline_comparison": {"baseline_mean": 72.0, "baseline_std": 0.5, "delta_mean": 0.1, "delta_std": 1.3, "percent_change": 0.1, "deviation_sigma": 0.2},
      "anomalies": [
        {
          "anomaly_id": "ANOM-FCV-001",
          "detection_method": "threshold_exceedance",
          "pattern": "step_change",
          "timestamp_start": "2026-03-10T14:21:18Z",
          "timestamp_end": "2026-03-10T14:21:22Z",
          "peak_value": 76.4,
          "promoted_to_kg_event": false
        }
      ],
      "changepoints": [],
      "within_normal_limits": false,
      "data_quality": {"missing_fraction": 0.0, "flatline_detected": false, "outlier_fraction": 0.0, "quality_flags": []}
    },
    {
      "sensor_id": "U1-ZI-CRD-2214",
      "parameter": "crd_2214_position",
      "unit": "steps",
      "stats": {"mean": 228.4, "std": 1.1, "min": 226.0, "max": 231.0, "p25": 228.0, "p75": 229.0, "p95": 230.0, "sample_count": 360},
      "baseline_comparison": {"baseline_mean": 228.5, "baseline_std": 0.2, "delta_mean": -0.1, "delta_std": 0.9, "percent_change": 0.0, "deviation_sigma": -0.5},
      "anomalies": [
        {
          "anomaly_id": "ANOM-CRD-001",
          "detection_method": "changepoint",
          "pattern": "step_change",
          "timestamp_start": "2026-03-10T14:22:13Z",
          "timestamp_end": "2026-03-10T14:22:15Z",
          "peak_value": 231.0,
          "promoted_to_kg_event": false
        }
      ],
      "changepoints": [],
      "within_normal_limits": false,
      "data_quality": {"missing_fraction": 0.0, "flatline_detected": false, "outlier_fraction": 0.0, "quality_flags": []}
    }
  ],
  "overall_assessment": {
    "any_anomaly_detected": true,
    "anomaly_count": 3,
    "most_anomalous_signal": "U1-NI-RPS-4A",
    "earliest_anomaly_time": "2026-03-10T14:21:18Z",
    "pattern_summary": "Three signals show anomalies. NI channel 4 step exceedance is the primary trip initiator. NI channels 1, 2, 3 show NO anomaly — a genuine power excursion would produce correlated response across all four channels; single-channel response strongly supports a spurious signal. FCV-FW-3301 position deviation at T-45s predates the trip signal; the causal relationship requires investigation. CRD-2214 position step at T+10s is a consequence of rod insertion, not a cause."
  }
}
