{
  "event_id": "EVT-U1B-2025-0312",
  "asset_id": "CHK-SW-HX-07A",
  "generated_at": "2025-03-12T09:00:00Z",
  "window": {
    "start": "2025-03-12T06:00:00Z",
    "end": "2025-03-12T09:00:00Z"
  },
  "analysis_methods": [
    "threshold_check",
    "descriptive_stats"
  ],
  "signals": [
    {
      "sensor_id": "U1B-PT-2201",
      "parameter": "sw_pump_discharge_pressure",
      "unit": "psig",
      "stats": {
        "sample_count": 1080,
        "mean": 82.4,
        "std": 0.6,
        "min": 81.1,
        "max": 83.7
      },
      "anomalies": [],
      "within_normal_limits": true
    },
    {
      "sensor_id": "U1B-FT-2204",
      "parameter": "sw_flow_to_edg_hx07a",
      "unit": "gpm",
      "stats": {
        "sample_count": 1080,
        "mean": 312.7,
        "std": 2.1,
        "min": 307.4,
        "max": 318.2
      },
      "anomalies": [
        {
          "anomaly_id": "ANOM-SURV-001",
          "detection_method": "other",
          "pattern": "sustained_exceedance",
          "timestamp_start": "2025-03-12T08:31:00Z",
          "timestamp_end": "2025-03-12T08:44:00Z",
          "severity_score": 0.6,
          "peak_value": 0.42,
          "promoted_to_kg_event": false,
          "promotion_rationale": "Surveillance-detected leakthrough; recorded in CAP as EVT-U1B-2025-0312. No continuous historian anomaly."
        }
      ],
      "within_normal_limits": false
    }
  ],
  "overall_assessment": {
    "any_anomaly_detected": true,
    "anomaly_count": 1,
    "most_anomalous_signal": "U1B-FT-2204",
    "earliest_anomaly_time": "2025-03-12T08:31:00Z",
    "pattern_summary": "SW pump discharge pressure nominal throughout window; no continuous historian anomaly. Single surveillance-detected leakthrough on flow path signal U1B-FT-2204 during controlled flow balance test step. Leakthrough rate 0.42 gpm exceeds acceptance criterion of 0.10 gpm. Telemetry score: 0.60 for Category A (direct measurement of failure condition), 0.40 for programmatic/organizational categories."
  }
}