{
  "event_id": "E2026-01-23-001",
  "asset_id": "PUMP_A_01",
  "generated_at": "2026-01-23T10:31:00Z",
  "window": {
    "start": "2026-01-23T10:00:00Z",
    "end": "2026-01-23T10:30:00Z"
  },
  "signals": [
    {
      "sensor_id": "S1_VIB",
      "parameter": "vibration",
      "unit": "mm/s",
      "anomalies": [
        {
          "anomaly_id": "ANOM_001",
          "detection_method": "matrix_profile",
          "pattern": "spike",
          "timestamp_start": "2026-01-23T10:15:00Z",
          "timestamp_end": "2026-01-23T10:15:00Z"
        }
      ],
      "stats": {
        "sample_count": 120,
        "mean": 8.2,
        "std": 0.9,
        "min": 6.8,
        "max": 10.1
      }
    }
  ]
}